Title,Upvotes,Content,Polarity,URL
Run,3187,"Run

Run. And if you can’t run then walk. 
And if you can’t walk, then crawl. But whatever you do, don’t stop. 

It’s only been an hour since everyone on earth, as far as I could tell, heard those same words. I was already walking through the park when I heard them, and after seeing what happens, I won’t be stopping anytime soon. 

It’s been two hours now, I’ve kept walking, I’m tired but stopping is not an option. Some people tried driving, but the act of getting in a car requires stopping, even for the briefest moment. And as those already driving when they heard the rules soon found out, it’s impossible to move indefinitely in a vehicle, especially in a crowded city. Their screams kept me moving. 

It’s been four hours now, and I’m exhausted, with the only thing pushing me forward being the fear of what awaits when I stop. And yes, I mean when, proven by plenty of those around me, eventually I’ll have to stop. Some have just given up, accepting their fate only to immediately regret the decision, some just couldn’t take the screams anymore, and most simply don’t see the point of continuing. And with every step I’m starting to become more like the latter. 

It’s been been about 6 hours, and for the first time i saw what happens up close. I was walking aimlessly down an alley, trying to get away from the madness, when I saw a young man no more then 16 crying. It didn’t even register at first to me until he made eye contact with me... he had stopped moving. His eyes were bloodshot, and not just whites around his pupils, I mean the entirety of his eyes were crimson red. Black tears streamed down his expressionless face, and then he smiled. A wide toothy smile that would’ve screamed of joy if it wasn’t followed by animalistic screams that would give the biggest horror fanatic nightmares. I wish I could say witnessing his dying moments was the most horrific thing to happen to me today, but then it hit me, the realization that I had stopped moving.",,https://www.reddit.com/r/scarystories/comments/ijjshz/run/
Emergency Alert. Do not look outside your windows.,2787,"EMERGENCY ALERT.

*Warning, this is not a test, I repeat, this is not a test. Citizens of the world. Lock all doors. Close all of your blinds. Do not go near any windows. Do not look outside. Do not leave your house. Stay in a room with no windows. Gather what supplies you can. Turn all of the lights off, do not open the door for anything.*

When I first heard it, it didn't even sound real. It sounded fake, like something in a horror movie, but it was an emergency so I decided I probably should do what they tell me. I grabbed a flashlight, pillow, my phone, charger, food and basic other stuff to keep me entertained while this stuff happened. I had no idea what was going on, but once I got into my bathroom and got comfy, I texted my parents asking them if they got the alert. They also did. ""They said citizens of the world, did they actually broadcast that to world?"" I asked myself. So I texted an internet friend that lives across the world, and they said they got it too. Same exact message. And to be honest, it's kinda scary, they tell you what to do, but not what's going on, and people are scared of that.

20 minutes later.

EMERGENCY ALERT.

*This is not a test, I repeat this is not a test. Unknown creatures have been knocking on peoples doors and been killing people that open the door. There is 5 major hotspots. Washington D.C, Tokyo, Toronto, Moscow and London. They have been located all around, but it seems as if they are attacking those first. This is an invasion. Stay in your rooms. Do not open any doors, do not look outside. They can kill you instantly with just a look. May god help us all*

Emergency nuke sirens are going off, tornado sirens are going off. What is going on. Is this a prank? How can an invasion be real? Are aliens real? How can I even comprehend that? I head car alarms going off, I hear things being destroyed. They are here. They are killing. It sounds like a warzone out there but without any guns. What can the government do? Just shoot them? But they would die looking at them. There's no possible way we could ever survive this. We are going to die.

I text my parents but no answer. I text my brother and sister, no answer. I start to panic now. What if my family is gone? And all I can do is listen to other peoples families get murdered. The nuke sirens have started again, and they are very loud. Shaking my whole apartment. I wonder what the other people in my building are thinking. Probably like me, this is it. This is the end of the world. Everyone on this planet will die. I hear a knock on my door. I don't answer it. I hear someone screaming for me to open it. I mean, it sounded human, should I open it? No. That would be stupid.

EMERGENCY ALERT

*This is not a test, I repeat, this is not a test, the extraterrestrial are attacking every major city in the world. There is a lot of them. We have not found out what they want. Stay inside. Millions if not billions are dead. Stay inside.*

It's as if the government have given up now. There's no way to fight and these messages are less helpful each time the come on. If billions are dying then I don't know how we can survive this. I mean, I have so far. But it doesn't sound like for long. I hear buildings being destroyed. I hear cars being destroyed. My building has been hit a few times. I'm hearing my world crumble before me. At this point there's no reason to hope anymore. There's so many dying and there is so much chaos, they will get everyone.

I would love to know what one of these things looks like. But if I see them. I die. I hope someone takes a picture, and if we do survive, I want to see it. I want to see what's killing us. But the end is nowhere near and I don't even know how many people we have left. Should I just kill myself? Maybe I should die before they get me. I don't want to die by those things. Plus, what if I do survive and get survivors guilt? Then there's no way I-

EMERGENCY ALERT

*This is not a test, I repeat, this is not a test. The extraterrestrial have left, and left billions of people dead. If you are alive, please tap the button on your phone now. If on a radio, tune to 104 and state your name and city. We will update you in 20 minutes*

There's no way I would want to live. That's what I was going to say. And yet, somehow, I'm actually alive. Do I want to die now? Well no. But how many people are alive. What did these things want. Why did they attack us? There's too many questions to even ask right now. At this point all we can do is try to figure out some numbers and restart society. How can a world like ours recover from something like this. How long until society is normal again. Will humanity ever me the same? I don't know. What I do know, is that I could off lost everything. I will text my friends and family and come back with some numbers.

EMERGENCY ALERT

*This is not a test. I repeat this is not a test. We have reported a little over 1 billion people accounted for. Not every country has the technology so we will investigate those country's in the coming months. We do not understand what these creatures wanted, nor what they have taken. In the next month or two we will be figuring out the next steps for humanity. May god help us all.*

Only 3 people I know survived. My sister, my uncle and my best friend. Everyone else is dead. I want to kill myself. But at the same time, humanity needs me. We need each other to continue human life. Only time will tell what to do next. If there is anything next.

Edit: It's 2 weeks later. The guilt is too much. I'm a fucking coward. Goodbye.",,https://www.reddit.com/r/scarystories/comments/jkbgv7/emergency_alert_do_not_look_outside_your_windows/
Go back to sleep,2356,,,https://i.redd.it/9gmvnmgty1l51.jpg
My son was diagnosed with something far worse than cancer.,2095,"

“Mommy, my privates hurt.”

Was there any way for me to know how frightening those four words were at the time?

Like any mother would do, I got on my knees. “Let me see,” 

My five-year-old son pulled down his pants and showed me. As I looked, a shock of fear went through me. His testicles were red and swollen.

I tried not to panic and thought about what it could be. Nothing - other than the worst-case scenario - came to mind. The night before, during bath time, his privates looked normal. 

What the hell happened?

Trying my best to not scare my son, quietly, I told him to pull up his pants and put on his shoes. We arrived at the doctor's office 20 minutes later.

After the examination, the doctor sent my son into the waiting room and called me in to have a private conversation.

Private conversation - no pun intended.

“Is it bad?” I asked.

The doctor gave me a look that I had scarcely ever seen. As if what I just asked was the biggest understatement of all time.

“Is it cancer?”

“Please sit down,” he said. “I haven’t seen anything like this during my time as a doctor that's for sure. I’ve already had a colleague of mine on the phone. We’re gonna need an ultrasound.”

Tears welled up in my eyes. “Tell me he’s going to be okay,”

“I can’t say for sure, but I can tell you that if it is some type of cancer, testicular is the easiest to treat.”

He paused.

”You said he’s 5 years old?”

I nodded and said, ”I don't understand how his… You know... he hasn't reached puberty yet, so… this can’t be normal for a boy his age. Can it?”

 ”Before we jump to any conclusions,” the doctor said, ”We need to see the ultrasound.”

Before paying for the visit, the doctor handed me a note with the date and location of the hospital where the ultrasound would be done.

He also advised that I set an ice pack over my son's groin every 2 hours in case the irritation got worse.

First thing the next morning, I drove to the address on the note and met with a man named Dr. Jasper Harris.

“Hello,” He said to me, and then he looked down at my son. He kneeled to his level. “Hello. What's your name?”

My son answered. 

The small talk was making me nervous. All I wanted was to get the procedure done and over with. The faster this would get done the faster my baby would get back to normal.

Dr. Harris led us both into a room and gave my son a hospital gown. 

I sat in the waiting room with a book while my son was scanned. Though I was looking at the pages, I wasn’t reading. My mind was elsewhere; on my son.

Later, Dr. Harris came into the waiting room with a dour look on his face.

“Come with me.” He said.

He brought me into a room full of medical computers.

“Please take a seat,” 

He pulled up a chair next to a large screen. He then showed me the X-Rays.

“Oh my god,” I said and covered my mouth. 

The X-Rays showed two testicles that were larger than any you’d see on a grown man. Both of them came up white on the ultrasound.

“Surgery must be done immediately.” Dr. Harris said, “I’ve never seen anything like this. It seems as if the tumors have encapsulated his testicles.”

I whimpered in the chair. A hand rested on my shoulder to console me. It didn’t help.

“Please,” I said, “Save my son.”

Nothing could be done that day because of complications due to the Coronavirus. I was lucky enough to even have gotten an appointment for the ultrasound that day, so I counted my blessings and stayed patient.

At this point, my son was almost completely in the dark about the whole thing - or so I thought.

We were driving home from the hospital, he was sitting in his booster seat when he asked:

“Mama?”

I looked at his reflection in the mirror. “Yes?”

“When we die, do we go to heaven like grandma says?”

I was speechless. What was I supposed to say? And how did the idea of death get on his mind? Did the doctor say something to him? Was it just a coincidence? Or was there some kind of primal intuitiveness that made him aware of how severe his illness was?

A single tear slipped down my cheek. “I don’t know, baby.”

. . .


He lay there on the operating table, unconscious.

The surgeon and his helpers were shuffling about, preparing for the incision of the cancerous bulbs hanging between my son's legs.

Before my son was put under, he cried and made it clear that he wanted me in the room while the surgery was performed.

“I want you with me,” He’d said.

To me it sounded as if he hadn’t finished the sentence; as if he was trying to say, “I want you with my incase I die.”

I stood in the corner of the cold operation room wearing a medical apron, rubber gloves, face mask, and a pair of goggles. I was looking at my feet, waiting for the inevitable. 

Would he be a freak to his peers?

An outcast to society?

Would he ever find someone to love him? Not as a mother, but as a lover? 

These strange, unwanted thoughts floated in my mind like a rocket on a predetermined trajectory through the star systems of the cosmos.

They told me not to watch if I didn’t want to. I wasn’t, but once I heard the scalpel cut through flesh, there was this sound. A wriggling sound. A sloppy, greasy… writhing sound.

The bodies of the medical professionals surrounded my son so I was unable to see him. I stood on my toes but I still wasn’t tall enough to see.

“Oh my god,” a nurse said.

“What the…” The surgeon said through his covered face.

Wet slapping sounds came. Something was dropping on the room's floor. 

Blood?

The doctor and nurses stood back. One nurse yipped and dropped a stainless steel tool she had been holding. She ran out of the room, the doors swinging behind her.

The sound of wet drips still came. I looked at the surgeon's feet. Something was wiggling on the floor.

Snakes?

No, too small for that.

Centipede? 

No, they didn’t have legs.

As the surgeon and the remaining nurse moved away from the table, I was able to see everything.

Everything.

Cracked open like eggs.

Honey, breakfast is ready.

Coming mom.

Mommy?

Yes?

My privates hurt.

Parasite?

Wet goo and slime from a world far beyond the comprehension of the human imagination spewed out from between my baby's legs. But no… let's not be too melodramatic.

I’ll just say it clearly and simply: My son's testicles had a nest of fucking worms inside of them. 

They writhed and squirmed and moved and slopped over the table; down to the floor, and over the shoes of the surgeon and nurse.

And guess what? Next thing I remember was blackness. I fainted and cracked my head on the tile floor.

I was removed from the room and woke up in a chair located in the large waiting area.  I remember squinting because the chair I was sitting in faced the windows where the sunset was.

Where was I?

Right, the hospital, 3rd floor.

A nurse with scrubs that were a size too small for her came over with a cup of water. 

How did they allow nurses to wear that? Her boobs were practically hanging…

“Ma’am?”

I blinked, and then my eyes focused on the nurse's face. 

“Y—yes?” I said.

“Please drink this,”

“My son,” I bolted straight up, “Where’s my son? Those things. Is he alright—“

Water tipped over the rim of the paper cup as she put a hand on my shoulder to sit me back down.

“He’s fine,” she answered, “There were just a few minor complications.”

Minor complications? Haha, very funny, wiggle wiggle woo. 

“He lost some blood but the procedure is over. You can see him in a few hours.”

I talked to the surgeon about what happened at the operation table. The only answer I got regarding what was inside of my son was: 

“We’re not completely sure what they are or what species of parasitic organisms they belong to. We’ve run some tests to see if he still had any left inside but we're not sure if he’s clean. We’ll have to put him on Mebendazole. It's the best we can do for now.”

And that was it. The men in the black suits showed up to interview me, my son, the surgeon, and both nurses.

Who were they? The fuck would I know?

. . .

It’s been two months since the operation. My son had to stay in a rehabilitation center for about a month and a half, which wasn’t fun for either of us. 

I’m now on anxiety medication. It started the day after I took my son home for the first time in a while. I just lay awake at night worrying about him.

Frequently, like every five minutes, I would get out of bed and go into his room to check on him. 

I wouldn’t get any sleep and I had to spend time away from work.

Things have been hard lately because of it, child support is next to nothing, no thanks to my ex-husband; at least it seems like the medication is working, so now I'm able to sleep.

They sent my son home with a clean bill of health minus two testicles - or so they thought.

I’m sitting in a waiting room once again.

Yesterday, while eating a bowl of cereal and watching the idiot box, my son stepped out of his bedroom and shuffled into the kitchen.

He said four words.

“Mommy, my eyes hurt.”",,https://www.reddit.com/r/scarystories/comments/jmuc22/my_son_was_diagnosed_with_something_far_worse/
